<?xml version="1.0" encoding="ISO-8859-1"?>
<SmartCardProfiles xmlns="http://www.progettopeople.it/sirac/peoplesmartcardprofiles" xmlns:scp="http://www.progettopeople.it/sirac/peoplesmartcardprofiles"
	xmlns:xsi="http://www.w3.org/2001/XMLSchema-instance" xsi:schemaLocation="http://www.progettopeople.it/sirac/peoplesmartcardprofiles smartcardprofiles.xsd">

	<!-- POSTECOM -->

	<SmartCardProfile cardType="Postecom">
		<CardDescription>Postecom Incrypto34v2</CardDescription>
		<CardATR>3bff1800ff8131fe55006b0209020001010144534410318092</CardATR>
		<CardLibraries>
			<CardLibrary type="pkcs11">incryptoki2.dll</CardLibrary>
			<CardLibrary type="csp">sysgillocsp.dll</CardLibrary>
		</CardLibraries>
		<CertificateIssuer>Postecom CA1</CertificateIssuer>
		<CertificateValidityCheck enabled="true" />
		<CertificateChainCheck enabled="true" />
		<CRLCheck enabled="false" onCardCrlURLCheck="true" overrideInternalCRLUpdateInterval="true" updateIntervalHours="10" crlFileName="PostecomIncrypto.crl">
			<alternativeCRLDistributionPointURL>http://postecert.poste.it/postecomca1/crl0</alternativeCRLDistributionPointURL>
		</CRLCheck>
		<DistinguishedNamePattern tokenSeparator="$" datePattern="dd/MM/yyyy">
			<![CDATA[OID.2.5.4.13="C=$Cognome$/N=$Nome$/D=$DataDiNascita$/R=TITOLARE", EMAILADDRESS=$Email$, CN=$Cognome$/$Nome$/$CodiceFiscale$/$CodiceCarta$, OU=Titolari, L=RA1, O=Utente Postecert, C=IT]]>
		</DistinguishedNamePattern>
	</SmartCardProfile>


	<SmartCardProfile cardType="Postecom">
		<CardDescription>Postecom Gemplus</CardDescription>
		<CardATR>3be200ffc11031fe55c8029c</CardATR>
		<CardLibraries>
			<CardLibrary type="pkcs11">gclib.dll</CardLibrary>
			<CardLibrary type="csp">gemcsp.dll</CardLibrary>
		</CardLibraries>
		<CertificateIssuer>Postecom CA1</CertificateIssuer>
		<CertificateValidityCheck enabled="true" />
		<CertificateChainCheck enabled="true" />
		<CRLCheck enabled="false" onCardCrlURLCheck="true" overrideInternalCRLUpdateInterval="false" updateIntervalHours="10" crlFileName="PostecomGemplus.crl">
			<alternativeCRLDistributionPointURL>http://postecert.poste.it/postecomca1/crl0</alternativeCRLDistributionPointURL>
		</CRLCheck>
		<DistinguishedNamePattern tokenSeparator="$" datePattern="dd/MM/yyyy">
			<![CDATA[OID.2.5.4.13="C=$Cognome$/N=$Nome$/D=$DataDiNascita$/R=TITOLARE", EMAILADDRESS=$Email$, CN=$Cognome$/$Nome$/$CodiceFiscale$/$CodiceCarta$, OU=Titolari, L=RA1, O=Postecom s.p.a., C=IT]]>
		</DistinguishedNamePattern>
	</SmartCardProfile>


	<SmartCardProfile cardType="Postecom">
		<CardDescription>Postecom Firma per Titolare - Autenticazione</CardDescription>
		<CardATR>3be200ffc11031fe55c8029c</CardATR>
		<CardLibraries>
			<CardLibrary type="pkcs11">incryptoki2.dll</CardLibrary>
			<CardLibrary type="csp">sysgillocsp.dll</CardLibrary>
		</CardLibraries>
		<CertificateIssuer>Postecom CA1</CertificateIssuer>
		<CertificateValidityCheck enabled="true" />
		<CertificateChainCheck enabled="true" />
		<CRLCheck enabled="false" onCardCrlURLCheck="true" overrideInternalCRLUpdateInterval="false" updateIntervalHours="10"
			crlFileName="PostecomFirmaTitolare.crl">
			<alternativeCRLDistributionPointURL>http://postecert.poste.it/postecomca1/crl0</alternativeCRLDistributionPointURL>
		</CRLCheck>
		<DistinguishedNamePattern tokenSeparator="$" datePattern="dd/MM/yyyy">
			<![CDATA[SURNAME=$Cognome$, GIVENNAME=$Nome$, CN=$Cognome2$/$Nome2$/$CodiceFiscale$/$CodiceCarta$, O=NON PRESENTE, C=IT]]>
		</DistinguishedNamePattern>
	</SmartCardProfile>


	<SmartCardProfile cardType="Postecom">
		<CardDescription>Postecom Firma per Titolare 2 - Autenticazione</CardDescription>
		<CardATR>3be200ffc11031fe55c8029c</CardATR>
		<CardLibraries>
			<CardLibrary type="pkcs11">incryptoki2.dll</CardLibrary>
			<CardLibrary type="csp">sysgillocsp.dll</CardLibrary>
		</CardLibraries>
		<CertificateIssuer>Postecom CA1</CertificateIssuer>
		<CertificateValidityCheck enabled="true" />
		<CertificateChainCheck enabled="true" />
		<CRLCheck enabled="false" onCardCrlURLCheck="true" overrideInternalCRLUpdateInterval="false" updateIntervalHours="10"
			crlFileName="PostecomFirmaTitolare2.crl">
			<alternativeCRLDistributionPointURL>http://postecert.poste.it/postecomca1/crl3</alternativeCRLDistributionPointURL>
		</CRLCheck>
		<DistinguishedNamePattern tokenSeparator="$" datePattern="dd/MM/yyyy">
			<![CDATA[SURNAME=$Cognome$, GIVENNAME=$Nome$, CN=$Cognome2$/$Nome2$/$CodiceFiscale$/$CodiceCarta$, O=POSTECOM SPA/05838841004, C=IT]]>
		</DistinguishedNamePattern>
	</SmartCardProfile>

	<SmartCardProfile cardType="Postecom">
		<CardDescription>Postecom Firma per Titolare 3 - Autenticazione</CardDescription>
		<CardATR>3be200ffc11031fe55c8029c</CardATR>
		<CardLibraries>
			<CardLibrary type="pkcs11">incryptoki2.dll</CardLibrary>
			<CardLibrary type="csp">sysgillocsp.dll</CardLibrary>
		</CardLibraries>
		<CertificateIssuer>Postecom CA1</CertificateIssuer>
		<CertificateValidityCheck enabled="true" />
		<CertificateChainCheck enabled="true" />
		<CRLCheck enabled="false" onCardCrlURLCheck="true" overrideInternalCRLUpdateInterval="false" updateIntervalHours="10"
			crlFileName="PostecomFirmaTitolare3.crl">
			<alternativeCRLDistributionPointURL>http://postecert.poste.it/postecomca1/crl3</alternativeCRLDistributionPointURL>
		</CRLCheck>
		<DistinguishedNamePattern tokenSeparator="$" datePattern="dd/MM/yyyy">
			<![CDATA[SURNAME=$Cognome$, GIVENNAME=$Nome$, CN=$Cognome2$/$Nome2$/$CodiceFiscale$/$CodiceCarta$, OU=$OrganizationUnit$ O=$Organization$, C=$Country$]]>
		</DistinguishedNamePattern>
	</SmartCardProfile>

	<SmartCardProfile cardType="Postecom">
		<CardDescription>Postecom Firma per Titolare - Firma digitale</CardDescription>
		<CardATR>3be200ffc11031fe55c8029c</CardATR>
		<CardLibraries>
			<CardLibrary type="pkcs11">incryptoki2.dll</CardLibrary>
			<CardLibrary type="csp">sysgillocsp.dll</CardLibrary>
		</CardLibraries>
		<CertificateIssuer>Postecom CA1</CertificateIssuer>
		<CertificateValidityCheck enabled="true" />
		<CertificateChainCheck enabled="true" />
		<CRLCheck enabled="false" onCardCrlURLCheck="true" overrideInternalCRLUpdateInterval="false" updateIntervalHours="10"
			crlFileName="PostecomFirmaTitolare.crl">
			<alternativeCRLDistributionPointURL>http://postecert.poste.it/postecomca1/crl0</alternativeCRLDistributionPointURL>
		</CRLCheck>
		<DistinguishedNamePattern tokenSeparator="$" datePattern="dd/MM/yyyy">
			<![CDATA[DNQ=$Dnq$, SURNAME=$Cognome$, GIVENNAME=$Nome$, SERIALNUMBER=IT:$CodiceFiscale$, CN=$CognomeNome$, O=$Organization$, C=$CountryCode$]]>
		</DistinguishedNamePattern>
	</SmartCardProfile>

	<SmartCardProfile cardType="Postecom">
		<CardDescription>Postecom Gemplus 2</CardDescription>
		<CardATR>3be200ffc11031fe55c8029c</CardATR>
		<CardLibraries>
			<CardLibrary type="pkcs11">gclib.dll</CardLibrary>
			<CardLibrary type="csp">gemcsp.dll</CardLibrary>
		</CardLibraries>
		<CertificateIssuer>Postecom CA1</CertificateIssuer>
		<CertificateValidityCheck enabled="true" />
		<CertificateChainCheck enabled="true" />
		<CRLCheck enabled="false" onCardCrlURLCheck="true" overrideInternalCRLUpdateInterval="false" updateIntervalHours="10" crlFileName="PostecomGemplus.crl">
			<alternativeCRLDistributionPointURL>http://postecert.poste.it/postecomca1/crl3</alternativeCRLDistributionPointURL>
		</CRLCheck>
		<DistinguishedNamePattern tokenSeparator="$" datePattern="dd/MM/yyyy">
			<![CDATA[SURNAME=$Cognome$, GIVENNAME=$Nome$, CN=$Cognome$/$Nome$/$CodiceFiscale$/$CodiceCarta$, O=$Organization$, C=IT]]>
		</DistinguishedNamePattern>
	</SmartCardProfile>

	<SmartCardProfile cardType="Postecom">
		<CardDescription>Postecom - Touch and Sign con chiavi DS a 2048 bits</CardDescription>
		<CardATR>3bff1800ff8131fe55006b0209030301010144534410318090</CardATR>
		<CardLibraries>
			<CardLibrary type="pkcs11">incryptoki2.dll</CardLibrary>
			<CardLibrary type="csp">sysgillocsp.dll</CardLibrary>
		</CardLibraries>
		<CertificateIssuer>Postecom CA2</CertificateIssuer>
		<CertificateValidityCheck enabled="true" />
		<CertificateChainCheck enabled="true" />
		<CRLCheck enabled="false" onCardCrlURLCheck="true" overrideInternalCRLUpdateInterval="false" updateIntervalHours="10"
			crlFileName="PostecomFirmaTitolare.crl">
			<alternativeCRLDistributionPointURL>http://postecert.poste.it/postecomca2/crl0.crl</alternativeCRLDistributionPointURL>
		</CRLCheck>
		<DistinguishedNamePattern tokenSeparator="$" datePattern="dd/MM/yyyy">
			<![CDATA[T=$Titolo$, DNQ=$Dnq$, SURNAME=$Cognome$, GIVENNAME=$Nome$, SERIALNUMBER=IT:$CodiceFiscale$, CN=$CognomeNome$, O=$Organization$, C=$CountryCode$]]>
		</DistinguishedNamePattern>
	</SmartCardProfile>

	<SmartCardProfile cardType="Postecom">
		<CardDescription>Postecom - Touch and Sign con chiavi DS a 2048 bits</CardDescription>
		<CardATR></CardATR>
		<CardLibraries>
			<CardLibrary type="pkcs11">incryptoki2.dll</CardLibrary>
			<CardLibrary type="csp">sysgillocsp.dll</CardLibrary>
		</CardLibraries>
		<CertificateIssuer>Postecom CA2</CertificateIssuer>
		<CertificateValidityCheck enabled="true" />
		<CertificateChainCheck enabled="true" />
		<CRLCheck enabled="false" onCardCrlURLCheck="true" overrideInternalCRLUpdateInterval="false" updateIntervalHours="10"
			crlFileName="PostecomFirmaTitolare.crl">
			<alternativeCRLDistributionPointURL>http://postecert.poste.it/postecomca2/crl0.crl</alternativeCRLDistributionPointURL>
		</CRLCheck>
		<DistinguishedNamePattern tokenSeparator="$" datePattern="dd/MM/yyyy">
			<![CDATA[DNQ=$Dnq$, SURNAME=$Cognome$, GIVENNAME=$Nome$, SERIALNUMBER=IT:$CodiceFiscale$, CN=$CognomeNome$, OU=$OrganizationUnit$, O=$Organization$, C=$CountryCode$]]>
		</DistinguishedNamePattern>
	</SmartCardProfile>

	<SmartCardProfile cardType="Postecom">
		<CardDescription>Postecom - Touch and Sign con chiavi DS a 2048 bits</CardDescription>
		<CardATR></CardATR>
		<CardLibraries>
			<CardLibrary type="pkcs11">incryptoki2.dll</CardLibrary>